[
  {
    "$kind": "defworkflow",
    "name": "aos.agent/SessionWorkflow@1",
    "state": "aos.agent/SessionState@1",
    "event": "aos.agent/SessionWorkflowEvent@1",
    "context": "sys/WorkflowContext@1",
    "key_schema": "aos.agent/SessionId@1",
    "effects_emitted": [
      "sys/blob.put@1",
      "sys/blob.get@1",
      "sys/llm.generate@1",
      "sys/host.session.open@1",
      "sys/host.exec@1",
      "sys/host.session.signal@1",
      "sys/host.fs.read_file@1",
      "sys/host.fs.write_file@1",
      "sys/host.fs.edit_file@1",
      "sys/host.fs.apply_patch@1",
      "sys/host.fs.grep@1",
      "sys/host.fs.glob@1",
      "sys/host.fs.stat@1",
      "sys/host.fs.exists@1",
      "sys/host.fs.list_dir@1",
      "sys/introspect.manifest@1",
      "sys/introspect.workflow_state@1",
      "sys/introspect.list_cells@1",
      "sys/workspace.resolve@1",
      "sys/workspace.empty_root@1",
      "sys/workspace.list@1",
      "sys/workspace.read_ref@1",
      "sys/workspace.read_bytes@1",
      "sys/workspace.write_bytes@1",
      "sys/workspace.write_ref@1",
      "sys/workspace.remove@1",
      "sys/workspace.diff@1"
    ],
    "impl": {
      "module": "aos.agent/SessionWorkflow_wasm@1",
      "entrypoint": "step"
    }
  }
]
