[
  {
    "$kind": "defworkflow",
    "name": "demiurge/Demiurge@1",
    "state": "demiurge/State@1",
    "event": "demiurge/WorkflowEvent@1",
    "context": "sys/WorkflowContext@1",
    "key_schema": "aos.agent/SessionId@1",
    "effects_emitted": [
      "sys/blob.put@1",
      "sys/host.session.open@1"
    ],
    "impl": {
      "module": "demiurge/Demiurge_wasm@1",
      "entrypoint": "step"
    }
  }
]
