[
  {
    "$kind": "defworkflow",
    "name": "sys/Workspace@1",
    "state": "sys/WorkspaceHistory@1",
    "event": "sys/WorkspaceCommit@1",
    "context": "sys/WorkflowContext@1",
    "key_schema": "sys/WorkspaceName@1",
    "effects_emitted": [],
    "impl": {
      "module": "sys/workspace_wasm@1",
      "entrypoint": "step"
    }
  }
]
